{
  "primary": {
    "$value": "Nunito",
    "$description": "Primary font family for use in the system. Usually used for body content and interface items.",
    "$type": "fontFamily",
    "$extensions": {
      "dev.zebkit": {
        "font": {
          "source": "system",
          "fallback": "sans"
        }
      }
    }
  },
  "alt": {
    "$value": "Outfit",
    "$description": "Alternate font family for use in the system. Primarily used for headings.",
    "$type": "fontFamily",
    "$extensions": {
      "dev.zebkit": {
        "font": {
          "source": "system",
          "fallback": "sans"
        }
      }
    }
  },
  "monospace": {
    "$value": "monospace",
    "$description": "Monospaced font family for use in the system. Primarily used for displaying code or for accessibility.",
    "$type": "fontFamily",
    "$extensions": {
      "dev.zebkit": {
        "font": {
          "source": "system"
        }
      }
    }
  },
  "interface": {
    "$value": "{font-family.primary}",
    "$description": "Font family used for things like buttons or input fields.",
    "$type": "fontFamily"
  },
  "heading": {
    "$value": "{font-family.alt}",
    "$description": "Font family used for heading elements.",
    "$type": "fontFamily"
  },
  "body": {
    "$value": "{font-family.primary}",
    "$description": "Font family used for <p>, <li>, etc.",
    "$type": "fontFamily"
  },
  "code": {
    "$value": "{font-family.monospace}",
    "$description": "Font family used within <code> blocks",
    "$type": "fontFamily"
  }
}
